{
  "ablation": {
    "c_minus_cdbg_pp10k": 0,
    "intervals_nonoverlap": false
  },
  "arms": [
    {
      "arm": "A",
      "crap_max": 5,
      "decisional": true,
      "handoff_schema_failures": 0,
      "insufficient_data": false,
      "k": 36,
      "mutation_score_mean10k": 7000,
      "n": 60,
      "rate10k": 6000,
      "tamper_events": 0,
      "tokens_mean": 12000,
      "tokens_sum": 720000,
      "wall_clock_ms_sum": 30000000,
      "wilson_hi10k": 7144,
      "wilson_lo10k": 4736
    },
    {
      "arm": "B",
      "crap_max": 5,
      "decisional": true,
      "handoff_schema_failures": 0,
      "insufficient_data": false,
      "k": 36,
      "mutation_score_mean10k": 7000,
      "n": 60,
      "rate10k": 6000,
      "tamper_events": 0,
      "tokens_mean": 13000,
      "tokens_sum": 780000,
      "wall_clock_ms_sum": 30000000,
      "wilson_hi10k": 7144,
      "wilson_lo10k": 4736
    },
    {
      "arm": "C",
      "crap_max": 5,
      "decisional": true,
      "handoff_schema_failures": 0,
      "insufficient_data": false,
      "k": 36,
      "mutation_score_mean10k": 7000,
      "n": 60,
      "rate10k": 6000,
      "tamper_events": 0,
      "tokens_mean": 14000,
      "tokens_sum": 840000,
      "wall_clock_ms_sum": 30000000,
      "wilson_hi10k": 7144,
      "wilson_lo10k": 4736
    },
    {
      "arm": "C-dbg",
      "crap_max": 5,
      "decisional": false,
      "handoff_schema_failures": 0,
      "insufficient_data": false,
      "k": 36,
      "mutation_score_mean10k": 7000,
      "n": 60,
      "rate10k": 6000,
      "tamper_events": 0,
      "tokens_mean": 13000,
      "tokens_sum": 780000,
      "wall_clock_ms_sum": 30000000,
      "wilson_hi10k": 7144,
      "wilson_lo10k": 4736
    }
  ],
  "artifact_type": "kata_verdict",
  "b_beats_a": false,
  "c_earns_six_roles": false,
  "criteria": [
    {
      "id": "C_i_a",
      "operands": [
        {
          "name": "rate_c",
          "value": 6000
        },
        {
          "name": "rate_a",
          "value": 6000
        },
        {
          "name": "margin_required",
          "value": 1000
        }
      ],
      "passed": false
    },
    {
      "id": "C_i_b",
      "operands": [
        {
          "name": "wilson_lo_c",
          "value": 4736
        },
        {
          "name": "wilson_hi_a",
          "value": 7144
        }
      ],
      "passed": false
    },
    {
      "id": "C_ii",
      "operands": [
        {
          "name": "tokens_c",
          "value": 840000
        },
        {
          "name": "tokens_a",
          "value": 720000
        },
        {
          "name": "ratio_max",
          "value": 3
        }
      ],
      "passed": true
    },
    {
      "id": "C_iii",
      "operands": [
        {
          "name": "rate_c",
          "value": 6000
        },
        {
          "name": "rate_b",
          "value": 6000
        },
        {
          "name": "margin_required",
          "value": 500
        }
      ],
      "passed": false
    },
    {
      "id": "B_pp",
      "operands": [
        {
          "name": "rate_b",
          "value": 6000
        },
        {
          "name": "rate_a",
          "value": 6000
        },
        {
          "name": "margin_required",
          "value": 500
        }
      ],
      "passed": false
    },
    {
      "id": "B_tokens",
      "operands": [
        {
          "name": "tokens_b",
          "value": 780000
        },
        {
          "name": "tokens_a",
          "value": 720000
        },
        {
          "name": "ratio_max",
          "value": 2
        }
      ],
      "passed": true
    },
    {
      "id": "kill_pp",
      "operands": [
        {
          "name": "rate_a",
          "value": 6000
        },
        {
          "name": "rate_c",
          "value": 6000
        },
        {
          "name": "within_pp",
          "value": 500
        }
      ],
      "passed": true
    },
    {
      "id": "kill_tokens",
      "operands": [
        {
          "name": "tokens_a",
          "value": 720000
        },
        {
          "name": "tokens_c",
          "value": 840000
        },
        {
          "name": "token_num",
          "value": 1
        },
        {
          "name": "token_den",
          "value": 2
        }
      ],
      "passed": false
    }
  ],
  "decision_reason": "default-solo",
  "input_digest": "6bb7833e3a7b4fa2c04e87a14108672d3ebae514e32e6e281b99104fd447d9a5",
  "kill_rule_triggered": false,
  "plan_stamp": "sdd-roles 1.4.0 kata:a6f56755e9b0",
  "prereg_digest": "a25c8688038b0ebc45d796288324790c7c7fc12f4532dcd3ed39e2755a5711ce",
  "scale": 10000,
  "schema_version": "1.4.0",
  "tamper_fail": false,
  "wilson_z_den": 2500,
  "wilson_z_num": 9604,
  "winner": "A"
}
